{
  "id": "skill_claude_video-generation",
  "schemaVersion": 1,
  "kind": "skill-inventory",
  "name": "video-generation",
  "tags": [
    "claude"
  ],
  "localPath": "/Users/circlelee/.claude/skills/video-generation/SKILL.md",
  "toolName": "claude",
  "frontmatter": {
    "name": "video-generation",
    "description": "Use this skill when the user requests to generate, create, or imagine videos. Supports structured prompts and reference image for guided generation."
  },
  "rawDescription": "Use this skill when the user requests to generate, create, or imagine videos. Supports structured prompts and reference image for guided generation.",
  "fileMtime": "2026-02-27T11:04:08.735Z",
  "fileHash": "2536e14c275c8eaad1cb22a7234c98be6826e9498a1819ebf9c7f71f7b52f9c9",
  "stats": {
    "usedInProjects": [],
    "useCount": 0
  },
  "createdAt": "2026-04-08T13:03:34.176Z",
  "updatedAt": "2026-04-08T13:03:34.176Z"
}
