{
  "id": "skill_claude_atomsyn-write",
  "schemaVersion": 1,
  "kind": "skill-inventory",
  "name": "atomsyn-write",
  "tags": [
    "claude"
  ],
  "localPath": "/Users/circlelee/.claude/skills/atomsyn-write/SKILL.md",
  "toolName": "claude",
  "frontmatter": {
    "name": "atomsyn-write",
    "description": "把当前对话里的关键学习沉淀进用户本地 Atomsyn 知识库,或者**更新/补充已有经验**。两种模式:(1) 新建 — 当用户说\"帮我记下来 / 这个要记住 / 存到我的 atomsyn / 存到 Atomsyn / 加到 Atomsyn / 加到我的知识库 / Atomsyn 记一下 / 别让我忘了 / save to my atomsyn / save to Atomsyn / remember this for me / crystallize this\"时。(2) 更新 — 当用户说\"更新那条经验 / 补充到之前那条 / 把这个也合进 X 里 / 修正刚才的 / 合并进旧的 / update that atom / merge into the existing one\"时,应先用 atomsyn-cli find 定位已有 id,再用 atomsyn-cli update 合并,**绝对不要**新建一条重复的。只在用户明确要求时调用,不要主动触发。",
    "allowed-tools": "Bash"
  },
  "rawDescription": "把当前对话里的关键学习沉淀进用户本地 Atomsyn 知识库,或者**更新/补充已有经验**。两种模式:(1) 新建 — 当用户说\"帮我记下来 / 这个要记住 / 存到我的 atomsyn / 存到 Atomsyn / 加到 Atomsyn / 加到我的知识库 / Atomsyn 记一下 / 别让我忘了 / save to my atomsyn / save to Atomsyn / remember this for me / crystallize this\"时。(2) 更新 — 当用户说\"更新那条经验 / 补充到之前那条 / 把这个也合进 X 里 / 修正刚才的 / 合并进旧的 / update that atom / merge into the existing one\"时,应先用 atomsyn-cli find 定位已有 id,再用 atomsyn-cli update 合并,**绝对不要**新建一条重复的。只在用户明确要求时调用,不要主动触发。",
  "fileMtime": "2026-04-09T05:41:04.824Z",
  "fileHash": "7cdb5ffd038c067d4852f76019b1376ec2839a39f4c121b48efc696ea1e4bb3d",
  "stats": {
    "usedInProjects": [],
    "useCount": 0
  },
  "createdAt": "2026-04-09T06:01:03.110Z",
  "updatedAt": "2026-04-09T06:01:03.110Z"
}
