{
  "id": "skill_claude_company-research",
  "schemaVersion": 1,
  "kind": "skill-inventory",
  "name": "company-research",
  "tags": [
    "claude"
  ],
  "localPath": "/Users/circlelee/.claude/skills/company-research/SKILL.md",
  "toolName": "claude",
  "frontmatter": {
    "name": "company-research",
    "description": "创建全面的公司档案，提取高管洞察、产品战略、转型计划和组织动态。用于理解潜在客户、合作伙伴或竞争对手。",
    "type": "component"
  },
  "rawDescription": "创建全面的公司档案，提取高管洞察、产品战略、转型计划和组织动态。用于理解潜在客户、合作伙伴或竞争对手。",
  "fileMtime": "2026-03-07T06:48:44.766Z",
  "fileHash": "2a9272f214a3e1b7a116eef3b32f87763e7d7ce8a1b49dac3aa48e63a340c1e8",
  "stats": {
    "usedInProjects": [],
    "useCount": 0
  },
  "createdAt": "2026-04-08T11:07:10.253Z",
  "updatedAt": "2026-04-08T11:07:10.253Z"
}
