{
  "id": "skill_claude_opportunity-solution-tree",
  "schemaVersion": 1,
  "kind": "skill-inventory",
  "name": "opportunity-solution-tree",
  "tags": [
    "claude"
  ],
  "localPath": "/Users/circlelee/.claude/skills/opportunity-solution-tree/SKILL.md",
  "toolName": "claude",
  "frontmatter": {
    "name": "opportunity-solution-tree",
    "description": "引导产品经理创建机会解决方案树(OST)，从利益相关者需求中提取目标成果，生成机会选项，映射潜在解决方案。",
    "type": "interactive"
  },
  "rawDescription": "引导产品经理创建机会解决方案树(OST)，从利益相关者需求中提取目标成果，生成机会选项，映射潜在解决方案。",
  "fileMtime": "2026-03-07T06:49:57.874Z",
  "fileHash": "053e07164baefaf56435a36e18995a1546be912bce1519de013a7854e8741cae",
  "stats": {
    "usedInProjects": [],
    "useCount": 0
  },
  "createdAt": "2026-04-08T11:07:10.264Z",
  "updatedAt": "2026-04-08T11:07:10.264Z"
}
