{
  "id": "skill_claude_finance-metrics-quickref",
  "schemaVersion": 1,
  "kind": "skill-inventory",
  "name": "finance-metrics-quickref",
  "tags": [
    "claude"
  ],
  "localPath": "/Users/circlelee/.claude/skills/finance-metrics-quickref/SKILL.md",
  "toolName": "claude",
  "frontmatter": {
    "name": "finance-metrics-quickref",
    "description": "SaaS财务指标快速参考表：32+指标的公式、基准值和使用场景，包含风险信号和决策框架。",
    "type": "component"
  },
  "rawDescription": "SaaS财务指标快速参考表：32+指标的公式、基准值和使用场景，包含风险信号和决策框架。",
  "fileMtime": "2026-03-07T06:49:57.874Z",
  "fileHash": "2425c2f909407ef32795fd9ad5a8949288c4d2b7c477f9f0c3be7fa74dc91d05",
  "stats": {
    "usedInProjects": [],
    "useCount": 0
  },
  "createdAt": "2026-04-08T11:07:10.261Z",
  "updatedAt": "2026-04-08T11:07:10.261Z"
}
