{
  "id": "skill_trae_frontend-design",
  "schemaVersion": 1,
  "kind": "skill-inventory",
  "name": "frontend-design",
  "tags": [
    "trae"
  ],
  "localPath": "/Users/circlelee/.trae/skills/frontend-design/SKILL.md",
  "toolName": "trae",
  "frontmatter": {
    "name": "frontend-design",
    "description": "Create distinctive, production-grade frontend interfaces with high design quality. Use this skill when the user asks to build web components, pages, artifacts, posters, or applications (examples include websites, landing pages, dashboards, React components, HTML/CSS layouts, or when styling/beautifying any web UI). Generates creative, polished code and UI design that avoids generic AI aesthetics.",
    "license": "Complete terms in LICENSE.txt"
  },
  "rawDescription": "Create distinctive, production-grade frontend interfaces with high design quality. Use this skill when the user asks to build web components, pages, artifacts, posters, or applications (examples include websites, landing pages, dashboards, React components, HTML/CSS layouts, or when styling/beautifying any web UI). Generates creative, polished code and UI design that avoids generic AI aesthetics.",
  "fileMtime": "2026-02-27T11:04:08.638Z",
  "fileHash": "f187caf13081bd3b5509f4c7424b7b507e3140020daaf3454b9181d1af4f61ca",
  "stats": {
    "usedInProjects": [],
    "useCount": 0
  },
  "createdAt": "2026-04-08T13:03:34.182Z",
  "updatedAt": "2026-04-08T13:03:34.182Z"
}
