{
  "id": "skill_claude_roadmap-planning",
  "schemaVersion": 1,
  "kind": "skill-inventory",
  "name": "roadmap-planning",
  "tags": [
    "claude"
  ],
  "localPath": "/Users/circlelee/.claude/skills/roadmap-planning/SKILL.md",
  "toolName": "claude",
  "frontmatter": {
    "name": "roadmap-planning",
    "description": "引导产品经理完成战略路线图规划，串联优先级排序、Epic定义、利益相关者对齐和发布排期。",
    "type": "workflow",
    "theme": "strategy-positioning",
    "best_for": "",
    "scenarios": "",
    "estimated_time": "45-90 min"
  },
  "rawDescription": "引导产品经理完成战略路线图规划，串联优先级排序、Epic定义、利益相关者对齐和发布排期。",
  "fileMtime": "2026-03-07T06:49:57.876Z",
  "fileHash": "1c6ee96564529433d32412614f3e9f0f8a0a043330315f91653c4c05de2b5239",
  "stats": {
    "usedInProjects": [],
    "useCount": 0
  },
  "createdAt": "2026-04-08T11:07:10.270Z",
  "updatedAt": "2026-04-08T11:07:10.270Z"
}
