{
  "id": "skill_claude_product-strategy-session",
  "schemaVersion": 1,
  "kind": "skill-inventory",
  "name": "product-strategy-session",
  "tags": [
    "claude"
  ],
  "localPath": "/Users/circlelee/.claude/skills/product-strategy-session/SKILL.md",
  "toolName": "claude",
  "frontmatter": {
    "name": "product-strategy-session",
    "description": "引导产品经理完成全面的产品战略会议，串联定位、问题框架、客户发现和路线图规划技能。",
    "type": "workflow"
  },
  "rawDescription": "引导产品经理完成全面的产品战略会议，串联定位、问题框架、客户发现和路线图规划技能。",
  "fileMtime": "2026-03-07T06:49:57.876Z",
  "fileHash": "8b71bc012e2af4abb6b9a41d9f2193b2e244bb8d80042a837f8322f21e96d696",
  "stats": {
    "usedInProjects": [],
    "useCount": 0
  },
  "createdAt": "2026-04-08T11:07:10.269Z",
  "updatedAt": "2026-04-08T11:07:10.269Z"
}
