{
  "id": "skill_claude_tam-sam-som-calculator",
  "schemaVersion": 1,
  "kind": "skill-inventory",
  "name": "tam-sam-som-calculator",
  "tags": [
    "claude"
  ],
  "localPath": "/Users/circlelee/.claude/skills/tam-sam-som-calculator/SKILL.md",
  "toolName": "claude",
  "frontmatter": {
    "name": "tam-sam-som-calculator",
    "description": "引导产品经理计算总可寻址市场(TAM)、可服务市场(SAM)和可获取市场(SOM)，通过自适应提问评估市场规模。",
    "type": "interactive"
  },
  "rawDescription": "引导产品经理计算总可寻址市场(TAM)、可服务市场(SAM)和可获取市场(SOM)，通过自适应提问评估市场规模。",
  "fileMtime": "2026-03-07T06:49:57.877Z",
  "fileHash": "91af24c25fdbebde7fd1b1f1c01a506caf1354c11df97629fb8979c4ec213224",
  "stats": {
    "usedInProjects": [],
    "useCount": 0
  },
  "createdAt": "2026-04-08T11:07:10.273Z",
  "updatedAt": "2026-04-08T11:07:10.273Z"
}
