{
  "id": "skill_claude_executive-onboarding-playbook",
  "schemaVersion": 1,
  "kind": "skill-inventory",
  "name": "executive-onboarding-playbook",
  "tags": [
    "claude"
  ],
  "localPath": "/Users/circlelee/.claude/skills/executive-onboarding-playbook/SKILL.md",
  "toolName": "claude",
  "frontmatter": {
    "name": "executive-onboarding-playbook",
    "description": "VP和CPO新任领导者的30-60-90天入职手册：先诊断再行动，发现未成文的战略，评估团队，建立决策依据。",
    "type": "workflow",
    "theme": "career-leadership",
    "best_for": "",
    "scenarios": "",
    "estimated_time": "20-30 min"
  },
  "rawDescription": "VP和CPO新任领导者的30-60-90天入职手册：先诊断再行动，发现未成文的战略，评估团队，建立决策依据。",
  "fileMtime": "2026-03-07T06:49:57.874Z",
  "fileHash": "b2117eca3baf4273e38e1a54db715e1a2d9c87ab34127002074d447c60aac1f8",
  "stats": {
    "usedInProjects": [],
    "useCount": 0
  },
  "createdAt": "2026-04-08T11:07:10.260Z",
  "updatedAt": "2026-04-08T11:07:10.260Z"
}
