{
  "id": "skill_cursor_atomsyn-read",
  "schemaVersion": 1,
  "kind": "skill-inventory",
  "name": "atomsyn-read",
  "tags": [
    "cursor"
  ],
  "localPath": "/Users/circlelee/.cursor/skills/atomsyn-read/SKILL.md",
  "toolName": "cursor",
  "frontmatter": {
    "name": "atomsyn-read",
    "description": "在回答用户问题之前,先到用户本地的 Atomsyn 知识库里查一下相关的过往经验,把命中的经验作为上下文注入到回答里。当用户说\"我之前学过类似的吗 / 我的知识库里有没有 / Atomsyn 里有没有 / 从 Atomsyn 里找 / 看看我之前记过什么 / 调用我的经验 / 我以前是怎么做的 / 查一下 atomsyn / Atomsyn 有没有相关的 / check my atomsyn / check Atomsyn / use my past experiences\"时触发。此外,在一个新会话开始处理实质性的编码/设计任务时,也应该**静默地主动调用一次**(一个会话一次预算),让用户的过往经验自动成为回答的底子,而不是被忽略。对于闲聊或与用户个人经验无关的通用问题,不要触发。",
    "allowed-tools": "Bash"
  },
  "rawDescription": "在回答用户问题之前,先到用户本地的 Atomsyn 知识库里查一下相关的过往经验,把命中的经验作为上下文注入到回答里。当用户说\"我之前学过类似的吗 / 我的知识库里有没有 / Atomsyn 里有没有 / 从 Atomsyn 里找 / 看看我之前记过什么 / 调用我的经验 / 我以前是怎么做的 / 查一下 atomsyn / Atomsyn 有没有相关的 / check my atomsyn / check Atomsyn / use my past experiences\"时触发。此外,在一个新会话开始处理实质性的编码/设计任务时,也应该**静默地主动调用一次**(一个会话一次预算),让用户的过往经验自动成为回答的底子,而不是被忽略。对于闲聊或与用户个人经验无关的通用问题,不要触发。",
  "fileMtime": "2026-04-09T05:41:04.826Z",
  "fileHash": "a9c1d9b51d632dc4f6209ccfe4ad19aafbb9b72a17e3391446e210715145f709",
  "stats": {
    "usedInProjects": [],
    "useCount": 0
  },
  "createdAt": "2026-04-09T06:01:03.149Z",
  "updatedAt": "2026-04-09T06:01:03.149Z"
}
