{
  "id": "skill_claude_altitude-horizon-framework",
  "schemaVersion": 1,
  "kind": "skill-inventory",
  "name": "altitude-horizon-framework",
  "tags": [
    "claude"
  ],
  "localPath": "/Users/circlelee/.claude/skills/altitude-horizon-framework/SKILL.md",
  "toolName": "claude",
  "frontmatter": {
    "name": "altitude-horizon-framework",
    "description": "PM到总监转型的核心思维模型：高度（范围）与视野（时间），从执行者到管理者的转变，四个转型区域和常见失败模式。",
    "type": "component",
    "theme": "career-leadership",
    "best_for": "",
    "scenarios": "",
    "estimated_time": "10-15 min"
  },
  "rawDescription": "PM到总监转型的核心思维模型：高度（范围）与视野（时间），从执行者到管理者的转变，四个转型区域和常见失败模式。",
  "fileMtime": "2026-03-07T06:48:43.133Z",
  "fileHash": "0b237e11ae1be38b68c61d4552fe2b9a1a5faeba08ebaa2a3091b38b795b4b1c",
  "stats": {
    "usedInProjects": [],
    "useCount": 0
  },
  "createdAt": "2026-04-08T11:07:10.251Z",
  "updatedAt": "2026-04-08T11:07:10.251Z"
}
