{
  "id": "skill_claude_github-deep-research",
  "schemaVersion": 1,
  "kind": "skill-inventory",
  "name": "github-deep-research",
  "tags": [
    "claude"
  ],
  "localPath": "/Users/circlelee/.claude/skills/github-deep-research/SKILL.md",
  "toolName": "claude",
  "frontmatter": {
    "name": "github-deep-research",
    "description": "Conduct multi-round deep research on any GitHub Repo. Use when users request comprehensive analysis, timeline reconstruction, competitive analysis, or in-depth investigation of GitHub. Produces structured markdown reports with executive summaries, chronological timelines, metrics analysis, and Mermaid diagrams. Triggers on Github repository URL or open source projects."
  },
  "rawDescription": "Conduct multi-round deep research on any GitHub Repo. Use when users request comprehensive analysis, timeline reconstruction, competitive analysis, or in-depth investigation of GitHub. Produces structured markdown reports with executive summaries, chronological timelines, metrics analysis, and Mermaid diagrams. Triggers on Github repository URL or open source projects.",
  "fileMtime": "2026-02-27T11:04:08.650Z",
  "fileHash": "6448edb94bf49fbd9d9b1dc36c9ecbe86174b0d015718cf3a1c13f50aec0a79b",
  "stats": {
    "usedInProjects": [],
    "useCount": 0
  },
  "createdAt": "2026-04-08T13:03:34.159Z",
  "updatedAt": "2026-04-08T13:03:34.159Z"
}
